Question Number,Question,Concepts
1,What is the derivative of sin(x)?,Differential Calculus; Trigonometric Functions; X )?
2,The integral of 1/x dx is:,Integral Calculus; X Dx; 1
3,"In a right triangle, if one angle is 30°, what is the ratio of the opposite side to the hypotenuse?","Proportions and Ratios; 30 °,; Geometry; One Angle; Triangle Properties; Opposite Side"
4,What is the sum of the first n natural numbers?,Number Theory; Sum; First N Natural Numbers
5,The quadratic formula is used to find:,Algebraic Equations; Used; Find
