Question Number,Question,Option A,Option B,Option C,Option D,Answer
1,"What is Newton's first law of motion?","An object at rest stays at rest","Force equals mass times acceleration","For every action there is an equal and opposite reaction","Energy cannot be created or destroyed",A
2,"The speed of light in vacuum is approximately:","3 × 10^8 m/s","3 × 10^6 m/s","3 × 10^10 m/s","3 × 10^5 m/s",A
3,"Which particle has no electric charge?","Proton","Electron","Neutron","Positron",C
4,"The unit of electric current is:","Volt","Ampere","Ohm","Watt",B
5,"What type of lens is used to correct nearsightedness?","Convex lens","Concave lens","Bifocal lens","Cylindrical lens",B
